{
  "schema_version": "1.0.0",
  "skill": "publish-ekyte",
  "mode": "preview",
  "publication_id": "acme-demo-pub-001",
  "client_id": "acme-demo",
  "task_id": "t-88089e96033baf68",
  "generated_at": "2026-01-20T09:00:00Z",
  "status": "success",
  "capability": "MANUAL_EXPORT",
  "publication_mode": "not_applicable",
  "approval_id": "acme-demo-appr-001",
  "approval_valid": true,
  "local_task": {
    "task_id": "t-88089e96033baf68",
    "title": "Configurar pixel de conversao no site",
    "description": "Configurar o pixel de conversao do Meta Ads no site ficticio da Acme Demo antes de escalar o investimento.",
    "due_at": "2026-01-23",
    "status": "pending",
    "existing_external": null
  },
  "payload": {
    "title": "Configurar pixel de conversao no site",
    "description": "Configurar o pixel de conversao do Meta Ads no site ficticio da Acme Demo antes de escalar o investimento.",
    "due_at": "2026-01-23",
    "omitted_fields": [
      "evidence_ids",
      "origin"
    ]
  },
  "blockers": [],
  "remote_result": null,
  "link_ekyte_operation": null,
  "receipt_ref": null,
  "warnings": [],
  "errors": []
}
